,ID,Country,Brand,Type,Package,Rating,Image
1199,1199,USA,Brand F,SGP Laksa Curry Soup Bowl,Bowl,4.3,
1200,1200,KOR,Brand A,Mild Kokomen (Prototype),Pack,4.5,
1201,1201,MYS,Brand B,Sajimee Curry Soup Flavour,Pack,4.3,
1202,1202,USA,Brand C,Miso Marvellous Soup,Pack,4,
1203,1203,PAK,Brand D,Shoop Instant Noodles Chicken Flavour,Pack,3.5,
1204,1204,IDN,Brand E,Mi Goreng Rasa Iga Penyet,Pack,4.8,
1205,1205,UK,Brand F,Traveller's Choice Thai Red Curry Flavour Instant Noodles,Pack,1.8,
1206,1206,KOR,Brand G,Barbecue Ramyun (Prototype),Pack,3.8,
1207,1207,JPN,Brand A,Red Pepper 7 Garlic Peperoncino,Pack,4,
1208,1208,JPN,Brand B,Sukiyaki Style Noodle Stew,Pack,4.5,
1209,1209,JPN,Brand C,Yaki-Udon Roast Soy Sauce,Pack,3.8,
1210,1210,JPN,Brand D,Hiyashi Udon Bonito Sauce,Pack,3,
1211,1211,JPN,Brand E,Futomen Yakisoba,Pack,4.8,
1212,1212,JPN,Brand F,Hiyashi Chuka Lemon Sauce,Pack,4.8,
1213,1213,JPN,Brand G,Curry Udon,Pack,5,
1214,1214,JPN,Brand A,Chanpon,Pack,3.8,
1215,1215,JPN,Brand B,Shio Yakisoba,Pack,4,
1216,1216,JPN,Brand C,Yakisoba,Pack,5,
1217,1217,JPN,Brand D,Yaki-Udon Mild Spicy Sauce,Pack,4.3,
1218,1218,JPN,Brand E,Katsuo Dashi Udon,Pack,3.8,
1219,1219,JPN,Brand F,Spaghetti Napolitan,Pack,4,
1220,1220,JPN,Brand A,Spicy Garlic Ramen,Pack,3.3,
1221,1221,UK,Brand B,Everyday Value Beef & Tomato Flavour Noodles,Cup,2,
1222,1222,KOR,Brand C,Nagasaki Jjamppong,Cup,3.8,
1223,1223,CAN,Brand D,Hearty Noodles Thai Flavour,Cup,0,
1224,1224,THA,Brand E,Oriental Style Instant 'Kua-Chap',Pack,3.3,
1225,1225,TWN,Brand F,Hello Kitty Za Jiang (Soybean Sauce),Pack,3.3,
1226,1226,DEU,Brand G,Soba Teriyaki Noodles With JPNese Yakisoba Sauce,Cup,3,
1227,1227,UK,Brand A,Instant Noodles Vegetable & Mushroom Flavour,Pack,1.5,
1228,1228,USA,Brand B,Sir Long Tang Creamy Beef Noodle Soup,Cup,4.3,
1229,1229,HKG,Brand C,Seaweed Hot & Spicy Instant Noodle Mushroom & Beef Flavour,Bowl,3.5,
1230,1230,CHN,Brand D,Korean Style Stew Pork Flavour Noodle Soup,Bowl,1.8,
1231,1231,HKG,Brand E,Instant Noodle King Won Ton Flavor,Pack,2.8,
1232,1232,MYS,Brand F,Instant Noodles Curry Flavour,Pack,3.5,
1233,1233,MYS,Brand G,Chef Creamy Tom Yam Flavour,Pack,5,
1234,1234,MYS,Brand A,Monster BBQ Flavour Snack Noodles,Pack,3.8,
1235,1235,MYS,Brand B,Chef Curry Laksa Flavour,Cup,5,
1236,1236,MYS,Brand C,SLLRRRP! Asam Laksa,Pack,4,
1237,1237,MYS,Brand D,Mie Goreng IDN Spicy Sambal,Cup,5,
1238,1238,MYS,Brand E,Chef Spicy Chicken Shiitake Flavour,Pack,3.3,
1239,1239,MYS,Brand F,Instant Vermicelli Chicken Flavour,Pack,3.3,
1240,1240,MYS,Brand A,Chef Creamy Tom Yam Flavour,Cup,4.8,
1241,1241,MYS,Brand B,Instant Noodles Vegetarian Flavour,Pack,3.8,
1242,1242,MYS,Brand C,SLLRRRP! Kari Berapi,Pack,3.8,
1243,1243,MYS,Brand D,Monster Chicken Flavour Snack Noodles,Pack,4,
1244,1244,MYS,Brand E,Chef Curry Laksa Flavour,Pack,5,
1245,1245,MYS,Brand F,Mie Goreng IDN Original Flavour,Cup,4.5,
1246,1246,MYS,Brand G,Instant Vermicelli Tom Yam Flavour,Pack,3.8,
1247,1247,KOR,Brand A,Bulnak Bokkummyun Spicy Fried Octopus Ramyun,Pack,4,
1248,1248,JPN,Brand B,Baby Star Ramen Round Consomme Mini,Pack,3.8,
1249,1249,USA,Brand C,Forbidden Rice Ramen,Pack,2.3,
1250,1250,USA,Brand D,Millet & Brown Rice Ramen,Pack,4,
1251,1251,USA,Brand E,Jade Pearl Rice Ramen,Pack,3.3,
1252,1252,MYS,Brand F,White Curry Noodle,Pack,4.5,
1253,1253,CAN,Brand G,Cuisine Adventures Chicken Pho Soup,Bowl,5,
1254,1254,IDN,Brand A,Taste Of Asia Mi Goreng Rasa Bulgogi Ala Korea,Pack,2.8,
1255,1255,THA,Brand B,Seaweed Instant Noodle,Tray,3.8,
1256,1256,UK,Brand C,Beef Ramen,Pack,1.5,
1257,1257,USA,Brand D,Chicken Ramen,Pack,4.3,
1258,1258,USA,Brand E,Shoyu Ramen,Pack,3.8,
1259,1259,USA,Brand F,Miso Ramen,Pack,4,
1260,1260,USA,Brand A,Curry Ramen,Pack,3.8,
1261,1261,USA,Brand B,Tom Yum Ramen,Pack,3.8,
1262,1262,USA,Brand C,Chicken Instant Noodle,Pack,3.8,
1263,1263,IDN,Brand D,Mushroom Instant Noodle,Pack,3.8,
1264,1264,JPN,Brand E,Beef and Mushroom Instant Noodle,Tray,5,
1265,1265,VNM,Brand F,Kimchi Ramen,Cup,1.3,
1266,1266,TWN,Brand G,Shoyu Ramen,Pack,3.8,
1267,1267,CHN,Brand A,Shoyu Ramen,Pack,3,
1268,1268,MYS,Brand B,Shoyu Ramen,Pack,3.8,
1269,1269,SGP,Brand C,Spicy Shrimp Tom Yam Flavour,Cup,3.3,
1270,1270,THA,Brand D,Instant Noodles Stewed Beef Flavour,Pack,3.5,
1271,1271,CHN,Brand E,Korean Style Mushroom Chicken Flavour Cooking Noodle,Pack,2,
1272,1272,KOR,Brand F,Instant Noodle Udon Hot & Spicy,Pack,4,
1273,1273,JPN,Brand G,Fresh Chow Mein Noodles With Seasoning,Pack,3.8,
1274,1274,THA,Brand A,Instant Noodles Cup Seafood Flavour,Cup,3.8,
1275,1275,MYS,Brand B,Mi Segera Kari Ayam Instant Noodles,Pack,4.3,
1276,1276,JPN,Brand C,Spa Oh Tarako Spaghetti,Bowl,4,
1277,1277,TWN,Brand D,Little Prince Brand Snack Noodles Original Flavor,Pack,2.5,
1278,1278,KOR,Brand E,Japchae Vermicelli Noodle,Pack,2.8,
1279,1279,UK,Brand F,Chicken Flavour Instant Noodles,Pack,2.8,
1280,1280,KOR,Brand A,Korean Traditional Beef Gomtangmen,Pack,5,
1281,1281,IDN,Brand B,Green Barley Noodle Vegetable Soup,Pack,3.3,
1282,1282,JPN,Brand C,I Want To Eat Ramen Miso Flavor,Pack,3.8,
1283,1283,IDN,Brand D,Spesial Rasa Soto Ayam,Pack,4,
1284,1284,USA,Brand E,Rice Noodle Cart Thai Peanut,Tray,3,
1285,1285,THA,Brand F,Oriental Style Instant Noodles Seafood Flavour,Cup,3.8,
1286,1286,KOR,Brand G,Soon Veggie Noodle Soup,Pack,5,
1287,1287,JPN,Brand A,Cup Noodle Cheese Curry,Cup,3.8,
1288,1288,SGP,Brand B,Oriental Style Instant Noodles Tom Yam Flavour,Pack,2.5,
1289,1289,TWN,Brand C,Instant Noodle Original Flavor,Pack,3.8,
1290,1290,HKG,Brand D,Demae Ramen Shoyu Tonkotsu Artificial Pork Flavour,Pack,4.8,
1291,1291,CAN,Brand E,Instant Noodles In A Cup Chicken Flavour,Cup,1.5,
1292,1292,THA,Brand F,Instant Noodles Yentafo Tom Yum Mohfai Flavour,Pack,5,
1293,1293,HKG,Brand G,Quick Serve Macaroni Shrimp Broth,Pack,3.3,
1294,1294,KOR,Brand A,Red Nagasaki Jjampong,Pack,5,
1295,1295,CAN,Brand B,Noodles In A Cup Spicy Chicken Simulated Flavour,Cup,1,
1296,1296,KOR,Brand C,Lightning Beef Bone Tteokguk Rice Cake Soup,Bowl,4,
1297,1297,IDN,Brand D,Mie Gepeng Kuah Rasa Ayam Lada Hitam,Pack,3.3,
1298,1298,TWN,Brand E,Ramen With Pickled Mustard Flavor,Pack,3.5,
1299,1299,TWN,Brand F,Steam Mushroom Flavor Ramen,Pack,3.3,
1300,1300,THA,Brand A,Instant Noodles Chicken Flavour,Cup,3,
1301,1301,SGP,Brand B,Prawn Noodles,Pack,4.3,
1302,1302,COL,Brand C,Cup Noodles Sabor A Carne Sopa Con Fideos,Cup,3,
1303,1303,VNM,Brand D,M Ly Instant Noodles M Tm Shrimp Flavor,Cup,3.3,
1304,1304,KOR,Brand E,Sain Sain Garlic Teriyaki Fresh Cooked Udon Pasta,Tray,4.5,
1305,1305,CHN,Brand F,Braised Beef Noodles,Pack,4,
1306,1306,HKG,Brand G,QQ Scallop Seafood Vermicelli,Bowl,3.8,
1307,1307,JPN,Brand A,Kumamoto Tonkotsu Ramen,Pack,5,
1308,1308,UK,Brand B,Super Noodles Roast Beef & Onion Flavour,Pack,3.3,
1309,1309,PHL,Brand C,Supreme Chow Mein Seafood Flavor Instant Stir-Fried Noodles,Bowl,3.3,
1310,1310,USA,Brand D,Rice Noodle Cart Sweet Citrus Ginger,Tray,4.3,
1311,1311,KOR,Brand E,Oolongmen Kimchi Cup Noodle Soup Mix,Cup,4,
1312,1312,SGP,Brand F,Purple Wheat Noodles Aglio Olio,Pack,2.8,
1313,1313,JPN,Brand G,Jet Black Sesame Oil Pork Tonkotsu,Bowl,2.3,
1314,1314,TWN,Brand A,Instant Noodle Udon Hot & Spicy,Pack,5,
1315,1315,UK,Brand B,Fresh Chow Mein Noodles With Seasoning,Pack,3.5,
1316,1316,KOR,Brand C,Instant Noodles Cup Seafood Flavour,Pack,3.3,
1317,1317,VNM,Brand D,Mi Segera Kari Ayam Instant Noodles,Pack,2,
1318,1318,MYS,Brand E,Spa Oh Tarako Spaghetti,Pack,4.3,
1319,1319,TWN,Brand F,Little Prince Brand Snack Noodles Original Flavor,Pack,4.5,
1320,1320,TWN,Brand A,Japchae Vermicelli Noodle,Pack,3.8,
1321,1321,UK,Brand B,Chicken Flavour Instant Noodles,Pack,3.3,
1322,1322,KOR,Brand C,Korean Traditional Beef Gomtangmen,Pack,3.5,
1323,1323,SGP,Brand D,Green Barley Noodle Vegetable Soup,Pack,5,
1324,1324,UK,Brand E,I Want To Eat Ramen Miso Flavor,Pack,5,
1325,1325,HKG,Brand F,Spesial Rasa Soto Ayam,Pack,2.5,
1326,1326,TWN,Brand G,Rice Noodle Cart Thai Peanut,Pack,3.3,
1327,1327,IDN,Brand A,Oriental Style Instant Noodles Seafood Flavour,Cup,3.8,
1328,1328,IDN,Brand B,Soon Veggie Noodle Soup,Cup,4,
1329,1329,IDN,Brand C,Cup Noodle Cheese Curry,Cup,3.8,
1330,1330,IDN,Brand D,Oriental Style Instant Noodles Tom Yam Flavour,Cup,4.3,
1331,1331,JPN,Brand E,Instant Noodle Original Flavor,Cup,4.3,
1332,1332,IDN,Brand F,Demae Ramen Shoyu Tonkotsu Artificial Pork Flavour,Cup,3.8,
1333,1333,IDN,Brand G,Instant Noodles In A Cup Chicken Flavour,Cup,3.8,
1334,1334,IDN,Brand A,Instant Noodles Yentafo Tom Yum Mohfai Flavour,Pack,5,
1335,1335,IDN,Brand B,Quick Serve Macaroni Shrimp Broth,Cup,3.8,
1336,1336,IDN,Brand C,Red Nagasaki Jjampong,Pack,4.5,
1337,1337,IDN,Brand D,Noodles In A Cup Spicy Chicken Simulated Flavour,Cup,4,
1338,1338,IDN,Brand E,Lightning Beef Bone Tteokguk Rice Cake Soup,Cup,4.3,
1339,1339,THA,Brand F,Mie Gepeng Kuah Rasa Ayam Lada Hitam,Cup,3.3,
1340,1340,HKG,Brand A,Ramen With Pickled Mustard Flavor,Bowl,2.8,
1341,1341,USA,Brand B,Steam Mushroom Flavor Ramen,Tray,3.8,
1342,1342,UK,Brand C,Instant Noodles Chicken Flavour,Pack,2.3,
1343,1343,THA,Brand D,Prawn Noodles,Pack,3.5,
1344,1344,KOR,Brand E,Cup Noodles Sabor A Carne Sopa Con Fideos,Bowl,3.8,
1345,1345,COL,Brand F,M Ly Instant Noodles M Tm Shrimp Flavor,Cup,2.8,
1346,1346,TWN,Brand G,Sain Sain Garlic Teriyaki Fresh Cooked Udon Pasta,Pack,4,
1347,1347,JPN,Brand A,Braised Beef Noodles,Pack,4,
1348,1348,USA,Brand B,QQ Scallop Seafood Vermicelli,Pack,4,
1349,1349,HKG,Brand C,Kumamoto Tonkotsu Ramen,Pack,3.5,
1350,1350,CHN,Brand D,Super Noodles Roast Beef & Onion Flavour,Pack,3.8,
1351,1351,HKG,Brand E,Demae Rice Vermicelli Chicken Flavour Instant Rice Vermicelli With Soup Base,Pack,1.8,
1352,1352,USA,Brand F,Garlic Chili Instant Rice Noodles & Sauce,Tray,4,
1353,1353,JPN,Brand G,Donbei Kansai Soy Sauce Flavor Udon,Pack,3.8,
1354,1354,MYS,Brand A,Big Kari Perencah (Big Curry Flavor) 2 Minute Noodles,Pack,4,
1355,1355,IDN,Brand B,Rasa Ayam Spesial,Pack,4,
1356,1356,JPN,Brand C,Sesame Ramen,Pack,5,
1357,1357,THA,Brand D,Instant Noodles Creamy Tom Yum Minced Pork Flavour,Pack,3.5,
1358,1358,KOR,Brand E,Dare You Habanero Ramyun,Cup,3.3,
1359,1359,HKG,Brand F,Demae Ramen Miso Tonkotsu Artificial Pork Flavor Ramen Noodle,Pack,3.8,
1360,1360,UK,Brand A,Barbecue Beef Flavour Instant Noodles,Pack,2.8,
1361,1361,COL,Brand B,Sabor A Pollo Sopa Instantnea Con Fideos,Pack,3.3,
1362,1362,IDN,Brand C,Mie Gepeng Kuah Rasa Ayam Bawang Pedas,Pack,3.3,
1363,1363,TWN,Brand D,Instant Noodle Shallot Flavor,Pack,3.8,
1364,1364,MYS,Brand E,Sajimee Original Soto Soup Flavor,Pack,4,
1365,1365,JPN,Brand F,Tonkotsu Ramen MEGA Dragon,Pack,2.5,
1366,1366,JPN,Brand G,Seimen JPNese Instant Ramen Noodles Shio Aji,Pack,3.8,
1367,1367,CAN,Brand A,Chicken Kimchi Oriental Style Noodles With Soup Base,Bowl,0.5,
1368,1368,CHN,Brand B,Artificial Braised Beef Flavor Instant Noodle,Bowl,3.8,
1369,1369,USA,Brand C,Pan Asian Kitchen Sweet & Sour Chicken Flavor Ramen Noodles,Tray,3.8,
1370,1370,KOR,Brand D,Premium Noodle House Seafood Ramyun,Pack,4,
1371,1371,MYS,Brand E,Instant Noodles Prawn Oriental Flavour,Pack,2.5,
1372,1372,DEU,Brand F,Soba Classic Noodles With JPNese Yakisoba Sauce,Cup,3.8,
1373,1373,IDN,Brand G,Selera Pedas Hot Semur Chicken Flavour,Pack,4.5,
1374,1374,JPN,Brand A,Ultraman Instant Noodle Pork Flavour,Cup,3,
1375,1375,JPN,Brand B,Mini Instant Noodle Spicy Flavor,Pack,3.5,
1376,1376,CHN,Brand C,Ho Fan Beef Soup Flavored,Pack,3.8,
1377,1377,HKG,Brand D,Hello Kitty Dim Sum Noodle JPNese Curry Flavour,Cup,3.5,
1378,1378,UK,Brand E,Super Low Fat Noodles Chilli Chicken Flavour,Pack,1,
1379,1379,IDN,Brand F,Mi Instan Cup Milk Chicken Soup,Cup,4.8,
1380,1380,IDN,Brand A,Rendang Beef Flavour Fried Instant Noodle,Cup,5,
1381,1381,CHN,Brand B,Hot -Dry Instant Noodles Chilli Flavour,Tray,0.5,
1382,1382,THA,Brand C,Instant Noodles Tom Yum Flavour,Pack,3.5,
1383,1383,HKG,Brand D,Demae Iccho Instant Noodle With Soup Base Artificial Chicken Flavour,Bowl,3,
1384,1384,TWN,Brand E,Hell Spicy Mala,Pack,4,
1385,1385,UK,Brand F,Instant Noodle Udon Hot & Spicy,Pack,3.3,
1386,1386,CHN,Brand G,Fresh Chow Mein Noodles With Seasoning,Pack,3.5,
1387,1387,JPN,Brand A,Instant Noodles Cup Seafood Flavour,Bowl,5,
1388,1388,TWN,Brand B,Mi Segera Kari Ayam Instant Noodles,Pack,1,
1389,1389,THA,Brand C,Spa Oh Tarako Spaghetti,Pack,3.5,
1390,1390,COL,Brand D,Little Prince Brand Snack Noodles Original Flavor,Cup,3.5,
1391,1391,IDN,Brand E,Japchae Vermicelli Noodle,Pack,3.5,
1392,1392,JPN,Brand F,Chicken Flavour Instant Noodles,Pack,3.3,
1393,1393,TWN,Brand G,Korean Traditional Beef Gomtangmen,Pack,4.3,
1394,1394,JPN,Brand A,Green Barley Noodle Vegetable Soup,Pack,3.8,
1395,1395,THA,Brand B,I Want To Eat Ramen Miso Flavor,Pack,3.8,
1396,1396,KOR,Brand C,Spesial Rasa Soto Ayam,Pack,5,
1397,1397,JPN,Brand D,Rice Noodle Cart Thai Peanut,Cup,4.5,
1398,1398,USA,Brand E,Oriental Style Instant Noodles Seafood Flavour,Bowl,3.5,
1399,1399,MYS,Brand F,Soon Veggie Noodle Soup,Pack,2.5,
1400,1400,KOR,Brand A,Cup Noodle Cheese Curry,Bowl,4,
1401,1401,DEU,Brand B,Oriental Style Instant Noodles Tom Yam Flavour,Cup,3.8,
1402,1402,TWN,Brand C,Instant Noodle Original Flavor,Pack,3.8,
1403,1403,IDN,Brand D,Demae Ramen Shoyu Tonkotsu Artificial Pork Flavour,Pack,4,
1404,1404,JPN,Brand E,Instant Noodles In A Cup Chicken Flavour,Bowl,3.8,
1405,1405,JPN,Brand F,Instant Noodles Yentafo Tom Yum Mohfai Flavour,Bowl,5,
1406,1406,CHN,Brand G,Quick Serve Macaroni Shrimp Broth,Cup,3,
1407,1407,KOR,Brand A,Red Nagasaki Jjampong,Cup,3.5,
1408,1408,COL,Brand B,Noodles In A Cup Spicy Chicken Simulated Flavour,Pack,3.8,
1409,1409,UK,Brand C,Lightning Beef Bone Tteokguk Rice Cake Soup,Pack,3.3,
1410,1410,JPN,Brand D,Mie Gepeng Kuah Rasa Ayam Lada Hitam,Cup,3.5,
1411,1411,KOR,Brand E,Ramen With Pickled Mustard Flavor,Pack,5,
1412,1412,UK,Brand F,Steam Mushroom Flavor Ramen,Pack,3.8,
1413,1413,KOR,Brand G,Instant Noodles Chicken Flavour,Pack,4,
1414,1414,TWN,Brand A,Prawn Noodles,Pack,3.8,
1415,1415,JPN,Brand B,Cup Noodles Sabor A Carne Sopa Con Fideos,Pack,4.3,
1416,1416,USA,Brand C,M Ly Instant Noodles M Tm Shrimp Flavor,Cup,5,
1417,1417,IDN,Brand D,Sain Sain Garlic Teriyaki Fresh Cooked Udon Pasta,Pack,4,
1418,1418,JPN,Brand E,Braised Beef Noodles,Pack,3.5,
1419,1419,IDN,Brand F,QQ Scallop Seafood Vermicelli,Pack,4.3,
1420,1420,JPN,Brand A,Kumamoto Tonkotsu Ramen,Pack,4,
1421,1421,IDN,Brand B,Super Noodles Roast Beef & Onion Flavour,Pack,3.5,
1422,1422,USA,Brand C,Seaweed Ramen Made With Organic Noodles,Pack,2.8,
1423,1423,UK,Brand D,Traveller's Choice IDNn Tikka Masala Flavour,Pack,3,
1424,1424,JPN,Brand E,Jan Jan Yakisoba,Cup,3.8,
1425,1425,CAN,Brand F,Noodles In A Cup Beef Simulated Flavour,Cup,1.8,
1426,1426,JPN,Brand G,Donbei Curry Udon (West JPNese),Bowl,3.3,
1427,1427,UK,Brand A,Miso Ramen,Cup,3.8,
1428,1428,TWN,Brand B,Man Han Feast Sichuan Chilli Eel Flavor,Bowl,5,
1429,1429,USA,Brand C,Chow Mein With Shrimp Chow Mein Noodles,Tray,3.8,
1430,1430,CAN,Brand D,Bowl Chicken Simulated Flavour,Bowl,2,
1431,1431,CHN,Brand E,Rice Vermicelli Spicy Beef With Chilli Flavour,Pack,3.3,
1432,1432,JPN,Brand F,Chanpon Ramen,Pack,4.8,
1433,1433,IDN,Brand G,100 Green Chilli Soto Flavour,Pack,3.8,
1434,1434,KOR,Brand A,Chacharoni,Pack,3.8,
1435,1435,JPN,Brand B,Yakisoba,Tray,5,
1436,1436,HKG,Brand C,Demae Iccho XO Sauce Seafood Flavour,Bowl,4,
1437,1437,UK,Brand D,The Nation's Noodle Beef & Tomato Flavour,Cup,4.3,
1438,1438,VNM,Brand E,Oriental Style Instant Vermicelli Sour Crab Flavour Soup,Pack,3.8,
1439,1439,USA,Brand F,Savory Ramen ,Bar,5,
1440,1440,CHN,Brand A,Korean Style Shrimp Flavour Cooking Noodle,Pack,3.5,
1441,1441,TWN,Brand B,Spicy Flavor Tomato Ramen,Pack,4,
1442,1442,JPN,Brand C,Tomato & Basil Shio Ramen,Pack,4,
1443,1443,NPL,Brand D,Fatafat Vegetable Flavor,Pack,3.8,
1444,1444,NPL,Brand E,Krrish Instant Noodles Chicken Flavor,Pack,3.5,
1445,1445,NPL,Brand F,Preeti Instant Noodles Chicken Soup Base,Pack,3.5,
1446,1446,NPL,Brand G,Miteri Instant Noodles Vegetable Flavor,Pack,3.5,
1447,1447,NPL,Brand A,Rumpum Chicken Soup Base,Pack,3.5,
1448,1448,NPL,Brand B,2pm Precooked Noodles Chicken Curry Delight,Pack,3.5,
1449,1449,NPL,Brand C,Fatafat Chicken Flavor,Pack,3.8,
1450,1450,NPL,Brand D,Krrish Instant Noodles Vegetable Curry Flavor,Pack,3.5,
1451,1451,NPL,Brand E,Rumpum Vegetable Soup Base,Pack,4.3,
1452,1452,NPL,Brand F,Miteri Instant Noodles Chicken Flavor,Pack,4,
1453,1453,NPL,Brand G,Joker Ready To Eat Noodles,Pack,3.3,
1454,1454,NPL,Brand A,Preeti Instant Noodles Veg Soup Base,Pack,5,
1455,1455,NPL,Brand B,Gaurav Chicken Seasoning,Pack,3.8,
1456,1456,JPN,Brand C,Downtown Ramen Shop Shoyu,Pack,4.8,
1457,1457,SGP,Brand D,Oriental Style Instant Noodles Crab Flavour,Pack,3.8,
1458,1458,JPN,Brand E,Yakisoba,Pack,5,
1459,1459,IDN,Brand F,Instant Noodle Beef & Lime Flavour,Pack,4.3,
1460,1460,KOR,Brand A,Katsuo Udon,Pack,4,
1461,1461,HKG,Brand B,E-Men Noodles Abalone Soup Flavor,Pack,3.8,
1462,1462,UK,Brand C,Kimchi Bowl Noodles Oriental Noodle With Soup Base,Cup,1.5,
1463,1463,TWN,Brand D,spicy Pad Thai Instant Noodles & Sauce,Pack,3.8,
1464,1464,USA,Brand E,Mini Instant Noodles Artificial Chicken Flavor,Cup,3.5,
1465,1465,JPN,Brand F,Pan Asian Kitchen Sukiyaki Beef Flavor Savory Soy Sauce Ramen Noodles,Pack,3.5,
1466,1466,PHL,Brand G,Special Instant Pancit Bihon With Kalamansi,Pack,3.3,
1467,1467,CAN,Brand A,Savory Ramen ,Cup,2.8,
1468,1468,IDN,Brand B,Korean Style Shrimp Flavour Cooking Noodle,Pack,4,
1469,1469,USA,Brand C,Spicy Flavor Tomato Ramen,Pack,5,
1470,1470,KOR,Brand D,Tomato & Basil Shio Ramen,Bowl,4.3,
1471,1471,JPN,Brand E,Fatafat Vegetable Flavor,Pack,4.3,
1472,1472,JPN,Brand F,Krrish Instant Noodles Chicken Flavor,Pack,4.3,
1473,1473,CHN,Brand G,Preeti Instant Noodles Chicken Soup Base,Pack,3.8,
1474,1474,IDN,Brand A,Selera Pedas Mi Rebus Hot Gulai Flavor,Pack,4.8,
1475,1475,UK,Brand B,Taste Sensation Instant Noodles Curry Flavour,Pack,3.8,
1476,1476,CAN,Brand C,Kimchi Bowl Noodles Oriental Noodle With Soup Base,Bowl,2.8,
1477,1477,USA,Brand D,spicy Pad Thai Instant Noodles & Sauce,Tray,4.3,
1478,1478,JPN,Brand E,Mini Instant Noodles Artificial Chicken Flavor,Pack,5,
1479,1479,USA,Brand F,Pan Asian Kitchen Sukiyaki Beef Flavor Savory Soy Sauce Ramen Noodles,Tray,3.8,
1480,1480,IDN,Brand A,Vegetarian Fried Noodles (Mie Goreng),Pack,4,
1481,1481,KOR,Brand B,Samyang Ramyun (SK Version),Cup,3.5,
1482,1482,THA,Brand C,Oriental Style Instant Kua-Chap Clear Soup,Pack,3.8,
1483,1483,CHN,Brand D,Korean Style Stew Beef Cooking Noodle,Pack,3.3,
1484,1484,KOR,Brand E,Gonghwachun Jjajangmyun,Pack,4.5,
1485,1485,IDN,Brand F,Spaghetti With Bolognese Sauce,Box,4.3,
1486,1486,CHN,Brand G,Spicy Beef,Cup,3.5,
1487,1487,HKG,Brand A,Demae Ramen Kimchi Flavour Instant Noodle With Soup Base,Bowl,3.5,
1488,1488,JPN,Brand B,Raoh Rich Soy Sauce With Roast Pork (2 Slices),Bowl,4.5,
1489,1489,KOR,Brand C,Doong Ji Authentic Korean Cold Noodles With Chili Sauce,Tray,5,
1490,1490,CAN,Brand D,Instant Noodles Chicken Flavour,Pack,3.5,
1491,1491,JPN,Brand E,Ippei-chan Yomise No Yakisoba Teriyaki Mayo Flavor,Tray,5,
1492,1492,UK,Brand F,Super Noodles Mild Mexican Chilli,Pack,3,
1493,1493,IDN,Brand G,Spicy Chicken Mi Instan Cup,Cup,4.3,
1494,1494,EST,Brand A,Instant Noodles With Chicken Flavour Broth,Pack,3.8,
1495,1495,EST,Brand B,Instant Noodles With Beef Flavour Broth,Pack,3.3,
1496,1496,IDN,Brand C,Low Fat Noodles Hainan Chicken,Pack,3.8,
1497,1497,TWN,Brand D,Homely Dried Noodles - Sesame Pate,Pack,3.8,
1498,1498,TWN,Brand E,Tachia Noodles - Hot & Spicy Sauce,Pack,3.5,
1499,1499,TWN,Brand F,Tachia Dried Noodles - Fried Shallot,Pack,3.3,
1500,1500,TWN,Brand A,Thin Noodles - Sesame Oil,Pack,4.3,
1501,1501,TWN,Brand B,Hakka Flat Noodles - Satay Sauce,Pack,4.5,
1502,1502,TWN,Brand C,Tachia Dried Noodles - Rou Zhou Meat Sauce,Pack,5,
1503,1503,TWN,Brand D,Homely Dried Noodles - Original Flavor ,Pack,4,
1504,1504,TWN,Brand E,Dried Noodles - Spicy Sauerkraut,Pack,3.3,
1505,1505,TWN,Brand F,Hakka Flat Noodles - Fried Bean Sauce,Pack,4.3,
1506,1506,TWN,Brand G,Tachia Dried Noodles - Peppery,Pack,3.8,
1507,1507,MYS,Brand A,Penang White Curry Noodle,Pack,5,
1508,1508,UK,Brand B,IDNn Curry Flavour,Pack,3,
1509,1509,VNM,Brand C,Hao Hao Mi Goreng Shrimp & Onion Flavour,Pack,3.5,
1510,1510,CAN,Brand D,Noodles In A Cup Chicken Simulated Flavour,Cup,1.5,
1511,1511,JPN,Brand E,GooTa Demi Hamburg-Men,Cup,4.8,
1512,1512,IDN,Brand F,Mi Goreng Cabe Ijo,Pack,4.5,
1513,1513,TWN,Brand G,Aloe Noodle Sesame Sauce,Pack,3.3,
1514,1514,TWN,Brand A,Black Eyed Beans Noodle Basil Sauce & Sesame Sauce,Pack,3.5,
1515,1515,TWN,Brand B,Aloe Noodle Vegetable Sauce,Pack,5,
1516,1516,TWN,Brand C,Black Eyed Beans Noodle Spicy Soybean Sauce & Sesame Sauce,Pack,3.8,
1517,1517,TWN,Brand D,Aloe Noodle Red Onion & Sesame Sauce,Pack,5,
1518,1518,TWN,Brand E,Black Eyed Beans Noodle Vegetable Sauce & Sesame Sauce,Pack,3.8,
1519,1519,TWN,Brand F,Aloe Noodle With Basil Sauce,Pack,5,
1520,1520,TWN,Brand A,Pollen Noodles Sesame Sauce & Soy Sauce,Pack,4.3,
1521,1521,TWN,Brand B,Black Eyed Bean Noodle Red Onion Sauce & Sesame Sauce,Pack,3.8,
1522,1522,TWN,Brand C,Aloe Noodle With Spicy Soybean Sauce,Pack,4,
1523,1523,JPN,Brand D,Raoh Soy Sauce Taste,Pack,4,
1524,1524,KOR,Brand E,Premium Noodle House Pork & Seafood Flavor,Pack,4,
1525,1525,JPN,Brand F,Raoh Rich Miso Flavor,Bowl,5,
1526,1526,SGP,Brand G,Oriental Instant Noodles Stir Fried Noodles,Pack,3.8,
1527,1527,JPN,Brand A,Cup Noodle Red Shock,Cup,3.8,
1528,1528,USA,Brand B,1 Step-1 Minute Asian Noodles Pad Thai,Pack,3.5,
1529,1529,USA,Brand C,1 Step-1 Minute Asian Noodles Kung Pao,Pack,4.3,
1530,1530,USA,Brand D,1 Step-1 Minute Asian Noodles Mushroom Lo Mein,Pack,4,
1531,1531,USA,Brand E,1 Step-1 Minute Asian Noodles Thai Basil,Pack,3.8,
1532,1532,USA,Brand F,1 Step-1 Minute Asian Noodles Lemongrass Ginger,Pack,3.8,
1533,1533,USA,Brand G,1 Step-1 Minute Asian Noodles Toasted Sesame,Pack,4,
1534,1534,USA,Brand A,Happy Pho VNMese Brown Rice Noodle Soup Garlic Goodness,Pack,3.8,
1535,1535,MYS,Brand B,Oriental Noodles Curry Flavour,Pack,3.3,
1536,1536,TWN,Brand C,Dry Noodle Mandarin Noodle - Original Sauce,Pack,4,
1537,1537,TWN,Brand D,Dry Noodle Hakka Noodle - Spicy Sesame Oil Sauce,Pack,3.5,
1538,1538,TWN,Brand E,Dry Noodle Mandarin Noodle - Onion Oil Sauce,Pack,5,
1539,1539,TWN,Brand F,Dry Noodle QQ Thin Noodle - BBQ Sauce,Pack,5,
1540,1540,TWN,Brand A,No. 10 Mandarin Noodle - Black Pepper Sauce,Pack,3.8,
1541,1541,TWN,Brand B,Dry Noodle Tainan Noodle - Sesame Sauce,Pack,4,
1542,1542,TWN,Brand C,Dry Noodle Hakka Noodle - Chili Sauce,Pack,4.3,
1543,1543,JPN,Brand D,Seimen JPNese Instant Ramen Noodles Soy Sauce Taste,Pack,3.8,
1544,1544,HKG,Brand E,JPNese Pork Bone Flavour Quick Serve Macaroni,Pack,3,
1545,1545,CAN,Brand F,Bowl Beef Simulated Flavor,Bowl,2,
1546,1546,KOR,Brand G,Cheese Bokki,Cup,3.5,
1547,1547,JPN,Brand A,Yakisoba Noodle,Tray,4,
1548,1548,USA,Brand B,Stir Fry Noodles JPNese Style Noodles With Sauce,Pack,4,
1549,1549,USA,Brand C,Chow Mein Chicken,Tray,3.5,
1550,1550,CHN,Brand D,Shin Ramyun Noodle Spicy Mushroom,Bowl,3.3,
1551,1551,CHN,Brand E,Rice Vermicelli Satay Chicken,Pack,3,
1552,1552,CHN,Brand F,Potato Pork Ramyun,Pack,5,
1553,1553,UK,Brand G,Instant Noodles Super Chow Mein,Pack,4,
1554,1554,CAN,Brand A,Instant Noodles Vegetable Flavour,Pack,1,
1555,1555,USA,Brand B,Bowl Hot & Spicy Shrimp Flavor Ramen Noodles With Vegetables,Bowl,4.3,
1556,1556,JPN,Brand C,Chanponmen,Pack,4.3,
1557,1557,KOR,Brand D,Dare You Habanero Jjamppong,Pack,4,
1558,1558,CHN,Brand E,Korean Style Spicy Shrimp Noodle Soup,Bowl,3.5,
1559,1559,TWN,Brand F,Spicy Sichuan Flavor Instant Noodle,Bowl,3.5,
1560,1560,CAN,Brand A,Instant Noodles In A Cup Spicy Chicken,Cup,2.3,
1561,1561,JPN,Brand B,King Cup Noodle BBQ Chicken & Onion,Cup,3.8,
1562,1562,THA,Brand C,Authentic Thai Cuisine Pad Thai,Pack,4,
1563,1563,KOR,Brand D,Premium Noodle House Don Ramyun,Pack,4,
1564,1564,KOR,Brand E,60 Ingredients Assorted Vegetable SK Version,Pack,3.8,
1565,1565,KOR,Brand F,Nagasaki Crab Jjampong,Pack,5,
1566,1566,KOR,Brand G,Buldalk Bokkeummyeon (Hot Fried Chicken Ramyun),Pack,4,
1567,1567,KOR,Brand A,Yukgaejang Beef Ramyun,Bowl,4,
1568,1568,KOR,Brand B,Bajirak Kalgugsu,Pack,3.8,
1569,1569,KOR,Brand C,Hot Chacharoni,Pack,3.8,
1570,1570,KOR,Brand D,Premium Noodle House Tofu Fried Noodle,Pack,3.5,
1571,1571,KOR,Brand E,Samyang Ramyun,Pack,4.5,
1572,1572,KOR,Brand F,Premuim Noodle House Crab Jjampong,Pack,5,
1573,1573,KOR,Brand G,Beef Flavor Ramyun (SK Version),Pack,4.3,
1574,1574,KOR,Brand A,Nagasaki Jjampong,Bowl,4.8,
1575,1575,KOR,Brand B,Kimchi Ramyun (SK Version),Pack,4,
1576,1576,KOR,Brand C,Ganjjampong,Pack,4.3,
1577,1577,KOR,Brand D,Sutah (SK Version),Pack,3.8,
1578,1578,USA,Brand E,Big Cup Noodles Habanero Lime Chicken Flavor Ramen Noodle Soup,Cup,3.5,
1579,1579,USA,Brand F,Oriental Style Ramen Noodle Soup,Pack,2.8,
1580,1580,JPN,Brand A,King Spa Oh Peperoncino Spaghetti (Spa ),Bowl,4.3,
1581,1581,VNM,Brand B,Chicken Ramen,Pack,3.5,
1582,1582,NLD,Brand C,Good Noodles Oosterse Kip (Oriental Chicken),Pack,3.5,
1583,1583,USA,Brand D,Bowl Hot & Spicy Chicken Flavor Ramen Noodles With Vegetables,Bowl,4,
1584,1584,CHN,Brand E,Korean Style Spicy Beef Noodle Soup,Bowl,3.8,
1585,1585,CAN,Brand F,Instant Noodles In A Cup Oriental,Cup,2,
1586,1586,KOR,Brand G,Sesame Flavor Noodle Bowl,Bowl,3.5,
1587,1587,HKG,Brand A,Demae Ramen Sesame Oil Flavour Noodles With Soup Base,Bowl,4.5,
1588,1588,POL,Brand B,Barszcz czerwony (Borscht),Pack,4,
1589,1589,CHN,Brand C,Chicken Flavour,Bowl,2.8,
1590,1590,THA,Brand D,Artificial Pork Flavour,Pack,3,
