,ID,Country,Brand,Type,Package,Rating,Image
806,806,MYS,Brand G,Curry Flavour Noodles,Cup,3,
807,807,MYS,Brand A,Kua Teaw Segera,Pack,4,
808,808,USA,Brand B,Chow Mein Premium Savory Sauce And Restaurant Quality Noodles Sriracha Flavor,Tray,4.3,
809,809,MYS,Brand C,Instant Noodles Black Pepper Crab Mi Goreng,Cup,3.5,
810,810,JPN,Brand D,Hakata Tonkotsu Ramen,Pack,5,
811,811,NLD,Brand E,Instant Noodles Creamy Tom Yum Shrimp Flavour,Pack,4.5,
812,812,CAN,Brand F,Beef Flavour Instant Noodles,Pack,0,
813,813,MYS,Brand G,Penang Hokkien Prawn Soup Rice Vermicelli (Bihun),Bowl,5,
814,814,KOR,Brand A,Non-Fried Noodle Blackbean Sauce Noodle With Squid,Pack,4.5,
815,815,TWN,Brand B,Instant Non-Fried Noodles Tomato Flavour,Pack,3.3,
816,816,CHN,Brand C,Spicy King Spicy Chicken,Pack,5,
817,817,CHN,Brand D,Supereme Bowl Noodles With Stewed Egg Spicy Flavour,Bowl,3.5,
818,818,CHN,Brand E,Spicy King Bowl Noodle Spicy Chicken,Bowl,5,
819,819,CHN,Brand F,Spicy King Bowl Noodle Spicy Beef,Bowl,4.3,
820,820,CHN,Brand A,Spicy King Spicy Pork,Pack,5,
821,821,CHN,Brand B,Supreme Bowl Noodles With Stewed Egg Sour Beans With Pork Flavour,Bowl,4,
822,822,CHN,Brand C,Spicy King Spicy Beef,Pack,5,
823,823,CHN,Brand D,Supreme Bowl Noodles With Stewed Egg Braised Beef Flavour,Bowl,3.5,
824,824,CHN,Brand E,Spicy King Bowl Noodle Spicy Pork,Bowl,4.5,
825,825,MYS,Brand F,Chef Lontong Flavour,Pack,5,
826,826,JPN,Brand G,Negi Miso No Ippin Ramen,Bowl,5,
827,827,KHM,Brand A,Instant Noodles Shrimp Tom Yum Flavour,Pack,4,
828,828,KOR,Brand B,Bulnak Boeummyun King Noodle,Bowl,3.5,
829,829,USA,Brand C,Cup Noodles Ramen Noodles With Shrimp (New Package) ,Cup,3.5,
830,830,FIN,Brand D,Nuudeli Tom Yum Katkarapu,Pack,3.8,
831,831,JPN,Brand E,Tuna Flavor Ramen,Pack,4.5,
832,832,TWN,Brand F,Sesame & Pepper,Pack,4,
833,833,USA,Brand G,Natural Quality Foods Pad Thai Noodle Bowl,Bowl,1,
834,834,JPN,Brand A,Homestyle Tonjiru,Bowl,4.5,
835,835,THA,Brand B,Cup Noodles Moo Manao Flavour,Cup,4,
836,836,MYS,Brand C,Duck Instant Noodles,Pack,3.5,
837,837,NLD,Brand D,Instant Noodles Beef Flavour,Pack,3.3,
838,838,TWN,Brand E,Veggie Noodle Carrot Noodle With Original Sauce,Pack,4.3,
839,839,BGD,Brand F,Oriental Style Instant Noodles Hot & Spicy Flavour,Pack,4,
840,840,KOR,Brand A,King Bowl Super Spicy Pan Stirfried Noodle,Bowl,5,
841,841,USA,Brand B,Garlic Rice Noodle Soup Bowl,Bowl,3.5,
842,842,JPN,Brand C,Mayo Ramen,Pack,4.8,
843,843,TWN,Brand D,Spicy & Sour Flavor,Pack,5,
844,844,IDN,Brand E,Instant Cup Mi Kuah Rasa Soto,Cup,5,
845,845,THA,Brand F,Jumbo Instant Noodles Tom Yum Kung Creamy Flavour,Pack,5,
846,846,CAN,Brand G,Chili Chicken Flavour Noodle Soup,Cup,3,
847,847,MYS,Brand A,Curry Instant Noodles,Pack,3.5,
848,848,JPN,Brand B,Ramen Shoyu Taste,Bowl,4.3,
849,849,NLD,Brand C,Good Noodles Kerrie,Pack,3.5,
850,850,TWN,Brand D,Veggie Noodle Baby Grass Noodle With Toona Sauce,Pack,5,
851,851,MMR,Brand E,Rangers Snack Noodles Shrimp Tom Yum Flavour,Pack,4.5,
852,852,MYS,Brand F,Curry Me! Penang White Curry Stir-fry Noodle,Pack,4.5,
853,853,USA,Brand G,Udon JPNese Style Pre-Cooked Noodles With Soup Chicken Flavor,Bowl,2.5,
854,854,CHN,Brand A,Braised Beef Noodle,Pack,4.3,
855,855,JPN,Brand B,Raoh Tanrei Koku Shio Ramen,Bowl,4.5,
856,856,THA,Brand C,Instant Noodles Shrimp Tom Yum Flavour,Cup,4.3,
857,857,IDN,Brand D,Instant Cup Mi Goreng,Cup,3.8,
858,858,MYS,Brand E,Monster Snek Mi Pedas,Pack,5,
859,859,CHN,Brand F,Tomato Sauce Instant Noodle,Bowl,4,
860,860,SGP,Brand A,Laksa Singapura,Pack,4.3,
861,861,DEU,Brand B,Instant Noodles Beef Flavour,Pack,3.8,
862,862,MYS,Brand C,Seafood Flavour Noodles,Cup,3.3,
863,863,KHM,Brand D,Instant Noodles Creamy Shrimp Tom Yum Flavour,Pack,5,
864,864,TWN,Brand E,BBQ Pork Flavor Chow Mein,Pack,4.5,
865,865,TWN,Brand F,Zan Vegetarian Instant Noodle Series Shiitake Mushroom Flavour,Cup,2.8,
866,866,JPN,Brand G,Tenobe Somen,Bowl,3.3,
867,867,TWN,Brand A,Jah Jan Men,Bowl,5,
868,868,VNM,Brand B,Oh! Ricey Pho Ga,Bowl,3,
869,869,TWN,Brand C,Veggie Noodle Black Sesame Noodle,Pack,3.3,
870,870,FIN,Brand D,Nuudeli Liha Nudlar Kott,Pack,3.5,
871,871,CHN,Brand E,Artificial Beef Instant Noodles With Soup Base,Pack,3.8,
872,872,MYS,Brand F,Otentiq Cheezy Curry Instant Noodles,Pack,4.5,
873,873,IDN,Brand G,Mi Goreng Dengan Abon,Pack,4.3,
874,874,MYS,Brand A,Chef Lontong Flavour,Cup,5,
875,875,THA,Brand B,Grilled Pork Flavour Instant Noodles,Bowl,2.5,
876,876,VNM,Brand C,Hao Hao Sate Onion Flavour,Cup,2.5,
877,877,MYS,Brand D,MYS White Laksa Instant Noodle,Pack,4,
878,878,MMR,Brand E,Instant Noodles Egg Protein Noodles,Pack,3.5,
879,879,THA,Brand F,Instant Noodles Minced Pork Flavor,Pack,3.8,
880,880,CHN,Brand A,Sichuan Hot Spicy Fish,Pack,3.8,
881,881,MYS,Brand B,Otentiq Cheezy Mushroom Instant Noodles,Pack,5,
882,882,JPN,Brand C,Organic Miso Ramen,Pack,4.5,
883,883,MYS,Brand D,Vegetarian Penang Laksa,Pack,4,
884,884,TWN,Brand E,Instant Non-Fried Noodles Vegetable Curry Flavor,Pack,5,
885,885,HUN,Brand F,Instant Noodles With Shrimp Flavouring,Pack,4,
886,886,MYS,Brand G,Sibu Instant Kampua Original,Pack,4,
887,887,CAN,Brand A,Hot & Spicy Flavour Noodle Soup,Bowl,3.5,
888,888,MYS,Brand B,Hot Cup Goreng Perencah Cili Fiesta,Cup,4.8,
889,889,MYS,Brand C,Gold Bihun Kari Heritage Instant Rice Vermicelli,Pack,4.5,
890,890,CHN,Brand D,Sour & Spicy Flavour,Pack,3.8,
891,891,THA,Brand E,Super Tom Yum Shrimp,Cup,3.5,
892,892,JPN,Brand F,Seafood Noodle,Cup,2.8,
893,893,JPN,Brand G,Organic Shoyu Ramen,Pack,4.3,
894,894,TWN,Brand A,Hakka Flat Noodle With Za Jiang Sauce,Pack,4,
895,895,MYS,Brand B,Mi goreng Pedas Chewy & springy,Pack,3.5,
896,896,USA,Brand C,Instant Lunch Chicken Tortilla Flavor Ramen Noodles With Vegetables,Cup,4,
897,897,MYS,Brand D,Instant Kampua Dark Soy Sauce,Pack,5,
898,898,THA,Brand E,Cup Yentafo Tom Yum Mohfai,Cup,5,
899,899,THA,Brand F,Cup Shrimp Creamy Tom Yum,Cup,5,
900,900,THA,Brand A,Instant Rice Vermicelli Bihun Goreng Original Flavour,Pack,4.8,
901,901,MMR,Brand B,Instant Noodles coconut Milk Flavour,Cup,5,
902,902,BGD,Brand C,Oriental Style Instant Noodles Chicken Flavour,Pack,3.3,
903,903,THA,Brand D,Instant Cup Noodles Minced Prok Flavor,Cup,3.5,
904,904,CHN,Brand E,Sour Bamboo Shoot & Beef If Hot Pot Flavor Noodles,Bowl,4,
905,905,CHN,Brand F,Tomato Beef Brisket Flavor Purple Potato Noodle,Pack,5,
906,906,CHN,Brand G,Sea Tangle & Sparerins Flavor Noodles,Bowl,3.8,
907,907,CHN,Brand A,Chef's Grains Millet Noodle,Pack,3.8,
908,908,CHN,Brand B,Chef's Grains Buckwheat Noodle,Pack,3.5,
909,909,CHN,Brand C,Chef's Grains Pea Noodle,Pack,4,
910,910,CHN,Brand D,Sichuan Pepper & Chicken Flavor Noodle,Bowl,4.5,
911,911,CHN,Brand E,Sour Soup & Minced Meat Flavor Chef's Grain Naked Oat Noodles,Pack,5,
912,912,CHN,Brand F,Sour Bamboo Shoot & Beef If Hot Pot Flavor Noodles,Pack,4,
913,913,CHN,Brand G,Sea Tangle & Sparerins Flavor Noodles,Bowl,3.8,
914,914,MYS,Brand A,Curry Me! Penang White Curry Soup Noodle,Pack,4.5,
915,915,TWN,Brand B,Veggie World Vegetarian Braised Beef Instant Noodles,Bowl,3.5,
916,916,USA,Brand C,Shin Black Spicy Po-Au-Feu Flavor (Mew Edition),Pack,5,
917,917,KOR,Brand D,Raobokki Noodle (Export Version),Pack,5,
918,918,MYS,Brand E,Emporer Herbs Chicken Noodle,Pack,4.3,
919,919,CHN,Brand F,Sauerkraut Flavor,Pack,4.5,
920,920,KOR,Brand A,Dare You! Habanero Ramen (New Edition),Cup,3.5,
921,921,TWN,Brand B,Black Cock Brand Vegetarian Chicken Noodle,Pack,3.5,
922,922,CAN,Brand C,Chili Seafood Flavor Noodle Soup,Cup,3.3,
923,923,MYS,Brand D,Penang Favourite White Curry Rice Vermicelli,Pack,5,
924,924,IDN,Brand E,Less Fat Noodles Grilled Chicken,Pack,3.8,
925,925,VNM,Brand F,Mi Ly Instant Noodles Mi Chay Vegetarian Flavor,Cup,1.3,
926,926,THA,Brand G,Cup Rice Vermicelli With Clear Soup,Cup,3.5,
927,927,TWN,Brand A,Aloe Thin Noodles With Camelia Oil Vegetable Sauce Flavor,Pack,5,
928,928,VNM,Brand B,Curry Instant Noodle With Chicken,Cup,3,
929,929,VNM,Brand C,Koreno Premium Mushroom Flavor,Pack,1.5,
930,930,MYS,Brand D,Seaweed Instant Noodle,Pack,2,
931,931,VNM,Brand E,Beef Ramen,Pack,4,
932,932,THA,Brand F,Chicken Ramen,Pack,5,
933,933,CHN,Brand G,Shoyu Ramen,Cup,3.8,
934,934,HKG,Brand A,Miso Ramen,Pack,3,
935,935,VNM,Brand B,Curry Ramen,Pack,2.8,
936,936,KOR,Brand C,Tom Yum Ramen,Bowl,5,
937,937,PAK,Brand D,Chicken Instant Noodle,Pack,2.8,
938,938,THA,Brand E,Mushroom Instant Noodle,Cup,3.5,
939,939,CHN,Brand F,Beef and Mushroom Instant Noodle,Pack,3,
940,940,MYS,Brand A,Kimchi Ramen,Pack,5,
941,941,MYS,Brand B,Shoyu Ramen,Pack,5,
942,942,MYS,Brand C,Shoyu Ramen,Pack,5,
943,943,MYS,Brand D,Shoyu Ramen,Pack,3.8,
944,944,KOR,Brand E,Sesame Flavor Ramen Korean Style Instant Noodle,Pack,4.3,
945,945,CHN,Brand F,Seafood Flavour Instant Cooking Noodles,Pack,4.3,
946,946,TWN,Brand G,Instant Noodles With Onion Flavour,Pack,4.3,
947,947,CAN,Brand A,Shrimp Flavour Oriental Noodles And Soup Mix,Cup,2.8,
948,948,VNM,Brand B,Spaghetti Instant Noodles,Tray,4,
949,949,PHL,Brand C,Supreme Jjamppong Korean Style Spicy Seafood Soup,Bowl,3.8,
950,950,MYS,Brand D,Vegetarian Penang Laksa Instant Bowl Noodles,Bowl,2,
951,951,KOR,Brand E,Dare You! Habanero Jjajang Ramen,Cup,3.5,
952,952,CAN,Brand F,Hearty Noodles Savoury Beef Flavour,Cup,0.3,
953,953,USA,Brand G,JPNese Ramen Noodle,Bowl,0,
954,954,TWN,Brand A,TWN Dried Noodles With Onion Oil Sauce,Pack,2,
955,955,MYS,Brand B,Bihun Creamy Tom Yam Flavour,Cup,3.8,
956,956,TWN,Brand C,Veggie Noodle Tomato Noodle With Vine Ripened Tomato Sauce,Pack,5,
957,957,DEU,Brand D,Instant Nudelsuppe Huhn Geschmack,Pack,3,
958,958,PAK,Brand E,Shoop Instant Noodles Masala Flavour,Pack,3.3,
959,959,THA,Brand F,Quick Zabb Tom Klong Flavour Instant Noodles,Pack,2.8,
960,960,KOR,Brand A,Shoyu Noodle,Cup,3.5,
961,961,VNM,Brand B,Mi Ly Instant Noodles Mi Bo Beef Flavor,Cup,3.5,
962,962,MYS,Brand C,Mi Segera Mmm... Perisa Kari,Pack,3,
963,963,JPN,Brand D,Donbei Tempura Soba Mini,Bowl,4,
964,964,CHN,Brand E,Korean Clay Pot Ramyun,Bowl,2.5,
965,965,MYS,Brand F,Penang Laksa Instant Bowl Noodles,Bowl,3.5,
966,966,CAN,Brand G,Kimchee Noodle Soup,Cup,0,
967,967,TWN,Brand A,Wei Wei A Instant Noodles Hot Beef Flavour,Bowl,2.5,
968,968,JPN,Brand B,Gonbuto Kistune Udon,Bowl,2.8,
969,969,THA,Brand C,Instant Rice Noodle Soup Spicy Shrimp Flavour,Bowl,5,
970,970,CHN,Brand D,Artificial Pork Flavour,Pack,3,
971,971,MYS,Brand E,Penang White Curry Noodle (New Improved Tatse),Pack,5,
972,972,USA,Brand F,Quick2 Hot & Spicy Noodle Soup With Habanero & Lime,Pack,4,
973,973,JPN,Brand G,MenWhite Creamy Tonkotsu,Bowl,3,
974,974,MYS,Brand A,Gold Penang Asam Laksa Bihun,Pack,3.3,
975,975,SGP,Brand B,Chu Qian Yi Ding Tom Yum Instant Noodles With Soup Base,Pack,3.8,
976,976,TWN,Brand C,Aloe This Noodles With Camellia Oil Spicy Bean Sauce Flavor,Pack,2.5,
977,977,MYS,Brand D,Penang Hokkien Prawn Noodle (New Improved Taste),Pack,5,
978,978,CHN,Brand E,Instant Noodles Artificial Spicy Beef Flavor (New Package),Pack,3.5,
979,979,CHN,Brand F,Shanghai Kaiyang Noodle,Pack,4,
980,980,MYS,Brand A,Penang White Curry Noodle,Pack,5,
981,981,JPN,Brand B,Kaoru Maitake Tempura Udon,Bowl,3.3,
982,982,PAK,Brand C,Shoop Instant Noodles Spicy Lemon Flavour,Pack,3.3,
983,983,PHL,Brand D,Supreme Seafood Flavor Big Cup,Bowl,4,
984,984,VNM,Brand E,Koreno Premium Ginseng Flavor,Pack,3,
985,985,JPN,Brand F,Brown Rice Ramen,Pack,0.3,
986,986,MYS,Brand G,Penang Vegetarian Prawn Instant Noodles,Pack,4.5,
987,987,JPN,Brand A,Nyumen Desse Shoyu,Bowl,2.8,
988,988,MYS,Brand B,Perencah Kari Letup Mi Segera,Pack,4,
989,989,HKG,Brand C,Demae Iccho Mushroom With Vegetables Flavour Macaroni,Pack,3.5,
990,990,JPN,Brand D,Mushroom Honpo Shiitake Nutritious Noodle,Pack,1,
991,991,IDN,Brand E,Mi Goreng Ala Jawa Dengan Sambal Cabe Asli,Pack,5,
992,992,VNM,Brand F,Mikochi Tom Yum Flavor Instant Noodles,Pack,3.5,
993,993,KOR,Brand G,Jinjja Jinjja (New),Pack,5,
994,994,TWN,Brand A,Instant Non-Fried Noodles Shallot Pork Flavour,Pack,5,
995,995,IDN,Brand B,Top Ramen Super Noodles Tomato,Pack,3.5,
996,996,THA,Brand C,Cup Rice Vermicelli Shrimp Creamy Tom Yum,Cup,4,
997,997,USA,Brand D,Original Chow Mein Premium Spicy Chicken Flavor,Tray,4,
998,998,MYS,Brand E,White Curry Noodle More Spicy,Pack,3,
999,999,CHN,Brand F,Emporer Instant Noodles Spicy Chicken,Pack,5,
1000,1000,JPN,Brand A,Jan Jan Dashi Shoyu Yakisoba,Cup,2.3,
1001,1001,KOR,Brand B,Tteokgukmyun,Pack,4.3,
1002,1002,TWN,Brand C,Vegan Chilli With Sesame Sauce,Pack,5,
1003,1003,MYS,Brand D,Perisa Sayuran,Pack,3.5,
1004,1004,MYS,Brand E,Perisa Kari Sayuran,Pack,3.8,
1005,1005,MYS,Brand F,Mi Perencah Ayam Jagung,Pack,3.8,
1006,1006,MYS,Brand G,Perisa Bayam,Pack,3.5,
1007,1007,MYS,Brand A,Plain Noodles,Pack,#VALUE!,
1008,1008,MYS,Brand B,Snek Mi Perisa Ayam,Pack,3.8,
1009,1009,MYS,Brand C,Nyonya Curry Laksa,Pack,5,
1010,1010,MYS,Brand D,Mi Perencah Asam Pedas,Pack,3.8,
1011,1011,MYS,Brand E,Snek Mi Perisa BBQ,Pack,4,
1012,1012,MYS,Brand F,Perisa Kari / Curry Flavour,Pack,4,
1013,1013,VNM,Brand G,3 Con Tom Instant Noodles THA Sour Shrimp Flavor,Pack,2.8,
1014,1014,KOR,Brand A,Dare You! Habanero Ramen (New Edition),Pack,3.8,
1015,1015,MYS,Brand B,Penang Authentic White Curry Noodle,Pack,4,
1016,1016,JPN,Brand C,Gonbuto Tempura Udon,Bowl,4,
1017,1017,THA,Brand D,Pork Flavour Whole Wheat Noodle,Pack,3.8,
1018,1018,IDN,Brand E,Authentic IDNn Noodles Vegetable Atta Masala,Pack,3.8,
1019,1019,KOR,Brand F,Jjajangmen Chajang Noodle King Bowl,Bowl,5,
1020,1020,TWN,Brand A,Steam Vegetarian Flavor Noodles,Pack,3.5,
1021,1021,MYS,Brand B,Penang White Curry Instant Bowl Noodles,Bowl,4.8,
1022,1022,CHN,Brand C,Artificial Seafood Flavor Instant Noodle,Pack,3.8,
1023,1023,MYS,Brand D,Choice Instant Noodles Curry Flavour,Pack,3.5,
1024,1024,JPN,Brand E,"Big Cup Ramen Corn, Salt & Butter Flavor",Bowl,5,
1025,1025,MYS,Brand F,Mi Goreng Perencah Kari Ori,Pack,4,
1026,1026,THA,Brand G,Instant Noodles Cup Beef Flavour,Cup,3.5,
1027,1027,JPN,Brand A,Emergency Cup Noodle,Cup,4.3,
1028,1028,IDN,Brand B,Cup Noodles Tomato Enjoy Noodles With Hot Soup,Cup,3.3,
1029,1029,JPN,Brand C,Baby Star Snack Noodle Chicken Flavour,Pack,2.5,
1030,1030,VNM,Brand D,M Ly Instant Noodles M Tht Xo Pork Flavor,Cup,3,
1031,1031,USA,Brand E,Shin Ramyun Noodle Soup (New Edition),Pack,4.3,
1032,1032,SGP,Brand F,Purple Wheat Noodles Soy & Vinegar Flavor,Pack,2.8,
1033,1033,MYS,Brand G,White Curry Noodle,Pack,4.5,
1034,1034,THA,Brand A,Instant Rice Noodle Spicy Seafood,Tray,3.8,
1035,1035,CHN,Brand B,Spicy Beef Flavor Instant Noodle,Pack,4,
1036,1036,CAN,Brand C,Beef Flavour Oriental Noodles And Soup Mix,Cup,2,
1037,1037,MYS,Brand D,Penang Laksa ,Pack,3.5,
1038,1038,IDN,Brand E,Hot Garlic Instant Noodles,Pack,3.8,
1039,1039,UK,Brand F,Instant Noodles Taste Sensation Mixed Vegetable Flavour,Pack,3.5,
1040,1040,SWE,Brand A,Asia Fast Noodles Snabbnudlar Rksmak,Pack,3,
1041,1041,MYS,Brand B,Mi Segera Perisa Itik,Pack,3.8,
1042,1042,THA,Brand C,Oriental Style Instant Noodles Pa-Lo Duck Flavour,Pack,3.5,
1043,1043,JPN,Brand D,Men Black Seafood Tonkotsu,Bowl,3.5,
1044,1044,MYS,Brand E,Penang White CurryMee,Pack,5,
1045,1045,CAN,Brand F,Chow Mein JPNese Style Noodles Yakisoba,Pack,5,
1046,1046,JPN,Brand G,Curry Noodle,Cup,3.8,
1047,1047,TWN,Brand A,Volcano Spicy Pork Noodle,Bowl,4.3,
1048,1048,HKG,Brand B,Demae Rice Vermicelli Beef Flavour,Pack,3.5,
1049,1049,MYS,Brand C,Penang Asam Pedas Hot & Sour Noodle,Pack,5,
1050,1050,USA,Brand D,Pad Thai Instant rice Noodles & Sauce,Tray,1.5,
1051,1051,IDN,Brand E,2 Minute Noodles Hungrooo Masala Spicy,Pack,3.8,
1052,1052,SGP,Brand F,Noodles Beef Flavour,Cup,2.5,
1053,1053,TWN,Brand G,Steam Pork Flavour,Pack,3.8,
1054,1054,CHN,Brand A,Instant Noodles Artificial Shallot Beef Flavour,Pack,4.3,
1055,1055,JPN,Brand B,Kimchi Noodle,Bowl,3.5,
1056,1056,HKG,Brand C,Oat Noodle Tomato Soup Flavored,Pack,4.5,
1057,1057,THA,Brand D,Quick Zabb Chili Paste Tom Yum Flavour Instant Noodles,Pack,3.8,
1058,1058,VNM,Brand E,Koreno Premium Shrimp Flavor,Pack,3.3,
1059,1059,HKG,Brand F,Oat Noodle Pork Rib Flavored,Pack,3.5,
1060,1060,MYS,Brand A,Seafood Instant Noodles,Pack,3.8,
1061,1061,VNM,Brand B,Sate Flavor Instant Noodles,Pack,3.8,
1062,1062,PHL,Brand C,Special Instant Noodles Jjamppong Flavor,Pack,4.5,
1063,1063,PHL,Brand D,Special Instant sopas Chicken Flavor,Pack,3.8,
1064,1064,PHL,Brand E,Spicy Beef Mami Instant Noodle Soup,Pack,4,
1065,1065,PHL,Brand F,Special Instant Curly Spaghetti With Yummy Red Sauce,Pack,4,
1066,1066,PHL,Brand G,Supreme Pinoy Chicken Instant Noodles,Cup,3.3,
1067,1067,PHL,Brand A,Special Baked Mac Style Instant Macaroni,Pack,4.5,
1068,1068,PHL,Brand B,La Paz Batchoy Instant Noodle Soup,Pack,3.8,
1069,1069,MYS,Brand C,Instant Kua Teow Tom Yam,Cup,3.8,
1070,1070,SGP,Brand D,Chu Qian Yi Ding Spicy Sesame Flavour Instant Noodles With Soup Base,Pack,3.5,
1071,1071,KOR,Brand E,Jjamppong Seafood Noodle King Bowl,Bowl,5,
1072,1072,VNM,Brand F,Instant Porridge Seafood Flavour,Pack,3.3,
1073,1073,JPN,Brand G,Gotsumori Sauce Yakisoba,Tray,5,
1074,1074,THA,Brand A,Oriental Style Instant Noodles Wasabi Flavour,Pack,3,
1075,1075,IDN,Brand B,Manchurian Instant Noodles,Pack,3.5,
1076,1076,MYS,Brand C,Chef Gold Recipe Bihun Kari Seribu Rasa,Pack,4.5,
1077,1077,SWE,Brand D,Instant Noodles Spicy Chili,Pack,3.5,
1078,1078,JPN,Brand E,Miso Ramen,Pack,3.8,
1079,1079,KOR,Brand F,Neoguri Udon Seafood & Mild,Pack,4,
1080,1080,MYS,Brand A,Royale Penang Seafood Curry,Pack,4.5,
1081,1081,THA,Brand B,Instant Noodles Tom Yum Pork Flavour,Pack,4,
1082,1082,HKG,Brand C,JPNese Fried Ramen Noodles Kyoto Barbecue Sauce Flavour,Pack,1.8,
1083,1083,TWN,Brand D,Tainan Yi Mien With Sesame Oil Sauce,Pack,3.3,
1084,1084,HKG,Brand E,Quick Serve Macaroni Wonton Broth,Pack,3.3,
1085,1085,JPN,Brand F,Donbei Kitsune Udon Mini,Bowl,3.5,
1086,1086,MYS,Brand G,Chef Gold Recipe Mi Kari Seribu Rasa,Pack,5,
1087,1087,SGP,Brand A,Chu Qian Yi Ding Prawn Flavour Instant Noodles With Soup Base,Pack,3.5,
1088,1088,IDN,Brand B,Cup Noodles Mug Noodles Spicy Vegetable,Pack,3.8,
1089,1089,PAK,Brand C,Shoop Instant Noodles BBQ Flavour,Pack,3.3,
1090,1090,CHN,Brand D,Stewed Beef Flavor Cooking Noodle,Pack,4.3,
1091,1091,USA,Brand E,Bowl Noodle Soup Shrimp Habanero Lime Flavor,Bowl,3.3,
1092,1092,CHN,Brand F,Artificial Pork Flavor Noodles,Pack,4,
1093,1093,JPN,Brand G,Ohmori Chukafu Yakisoba,Tray,3.3,
1094,1094,MYS,Brand A,Penang Red Tom Yum Goong Noodle,Pack,5,
1095,1095,VNM,Brand B,Instant Noodles Xi Gon Artificial Stewed Beef Flavor,Pack,3.3,
1096,1096,KOR,Brand C,Sogokimyun Hot Flavor Noodle Soup,Pack,3.5,
1097,1097,USA,Brand D,Easy Fideos Picante Lime Shrimp Flavor Ramen Noodle Soup,Cup,3.5,
1098,1098,CHN,Brand E,Mianba Pork Ribs Flavor Instant Noodles,Pack,4.5,
1099,1099,MYS,Brand F,Instant Noodles Mee Goreng,Cup,3.8,
1100,1100,IDN,Brand A,Pop Mie Chicken Flavour Cup Noodles,Cup,3.5,
1101,1101,JPN,Brand B,Magomi-an Kitsune Udon (Eastern JPN Flavor),Bowl,4.3,
1102,1102,THA,Brand C,Quick Zabb Tom Yum Shrimp Flavour Instant Noodles,Pack,4,
1103,1103,KOR,Brand D,Potato Ramen,Pack,3.8,
1104,1104,DEU,Brand E,Soba Chili Noodles With JPNese Yakisoba Sauce,Cup,3.5,
1105,1105,IDN,Brand F,Multigrainz Noodles Spice Remix,Pack,3.3,
1106,1106,TWN,Brand G,Sichuan Spicy Flavor,Pack,5,
1107,1107,SWE,Brand A,Asia Snabbnudlar Kycklingsmak,Pack,3.3,
1108,1108,TWN,Brand B,Onion Oil & Shrimp Flavor,Pack,5,
1109,1109,USA,Brand C,Spicy Tonkotsu Noodle Soup,Pack,5,
1110,1110,MYS,Brand D,Mee Baa..Gus Mi Goreng Spicier Original Flavour,Pack,3.8,
1111,1111,HKG,Brand E,Hot & Spicy Instant Noodle (Mushroom & Beef Flavour),Pack,4,
1112,1112,JPN,Brand F,I Want To Eat Ramen' Shoyu Flavor,Pack,4,
1113,1113,CHN,Brand G,Mushroom Stew Chicken Ramen,Pack,3.5,
1114,1114,KOR,Brand A,Jjol Bibim Men,Pack,4,
1115,1115,USA,Brand B,Cup Noodles Easy Fideos Tomato Chicken Flavor Ramen Noodle Soup,Cup,3.5,
1116,1116,THA,Brand C,Tom Yam Flavour Instant Noodles,Pack,4,
1117,1117,THA,Brand D,Instant Noodles Moo Nam Tok Flavour,Pack,4,
1118,1118,DEU,Brand E,Instant Nudelsuppe Shrimp Flavour,Pack,3.5,
1119,1119,THA,Brand F,Cup Oriental Style Instant Noodles Chicken Flavour,Cup,3.3,
1120,1120,THA,Brand A,Instant Noodle Shrimp Tom Yum Flavour Jumbo Pack,Pack,4,
1121,1121,THA,Brand B,Instant Cup Noodles Shrimp Tom Yum Flavour (Extreme),Cup,5,
1122,1122,THA,Brand C,Chicken Masala Flavour Instant Fried Noodles,Pack,3.8,
1123,1123,THA,Brand D,Instant Noodles Shrimp Creamy Tom Yum Flavour Jumbo Pack,Pack,5,
1124,1124,THA,Brand E,Instant Cup Noodles Spicy Cheese Flavour,Cup,3.5,
1125,1125,DEU,Brand F,Oriental Style Instant Noodles Beef Flavour,Pack,3.3,
1126,1126,THA,Brand G,Instant Cup Noodles Seafood Pad Kee Mao Flavour,Cup,5,
1127,1127,THA,Brand A,Creamy Tom Yam Instant Noodles,Pack,4.5,
1128,1128,THA,Brand B,Oriental Style Instant Noodles Green Curry Flavour Jumbo Pack,Pack,5,
1129,1129,DEU,Brand C,"Shrimp ""Tom Yum"" Instant Nudelsuppe",Pack,3.5,
1130,1130,MYS,Brand D,Penang White curry Noodle With Nanyang Chilli Paste,Pack,4.8,
1131,1131,USA,Brand E,Instant Lunch California Vegetable Ramen Noodles With Vegetables,Cup,3.5,
1132,1132,TWN,Brand F,Steam Instant Noodles Korean Salt & Rib Soup Flavour,Bowl,2.3,
1133,1133,SGP,Brand G,Cup Noodles Black Pepper Crab Flavour,Cup,4,
1134,1134,SGP,Brand A,Premium Instant Noodles Spicy Beef Flavour,Pack,3.8,
1135,1135,SGP,Brand B,Cup Noodles Tom Yam Veg Flavour,Cup,4,
1136,1136,SGP,Brand C,Premium Instant Noodles Roasted Beef Flavour,Bowl,3.8,
1137,1137,SGP,Brand D,Chu Qian Yi Ding Sesame Oil Flavour,Pack,3.8,
1138,1138,SGP,Brand E,Cup Noodles Chicken Flavour,Cup,3.5,
1139,1139,SGP,Brand F,Premium Instant Noodles XO Sauce Seafood Flavour,Pack,3.8,
1140,1140,SGP,Brand A,Cup Noodles Chilli Crab Flavour,Cup,4,
1141,1141,SGP,Brand B,JPNese Ramen Kyushu Black Instant Noodles With Soup Base,Pack,5,
1142,1142,SGP,Brand C,Premium Instant Noodles Spicy Beef Flavour,Bowl,3.8,
1143,1143,SGP,Brand D,Cup Noodles Tom Yam Seafood Flavour,Cup,4,
1144,1144,SGP,Brand E,JPNese Ramen Tokyo Shoyu Instant Noodles With Soup Base,Pack,5,
1145,1145,SGP,Brand F,Cup Noodles Seafood Curry Flavour,Cup,4,
1146,1146,SGP,Brand G,Premium Instant Noodles Roasted Beef Flavour,Pack,4.3,
1147,1147,SGP,Brand A,Cup Noodles Cream Of Chicken Flavour,Cup,4,
1148,1148,JPN,Brand B,Ippei-Chan Jumbo Night Market Style Yakisoba,Tray,4.5,
1149,1149,MYS,Brand C,Penang Hokkien Prawn Noodle,Pack,5,
1150,1150,USA,Brand D,Instant Lunch Jalapeno Cheddar Flavor Ramen Noodles,Cup,3.5,
1151,1151,USA,Brand E,Harmony Korean Spicy Noodle Dish With Chipotle,Pack,4.3,
1152,1152,SGP,Brand F,2 Minute Noodles Tom Yam Flavour,Pack,3.5,
1153,1153,USA,Brand G,Souper Meal Chili Picante Chicken With Lime Flavor Ramen Noodle Soup,Bowl,3.5,
1154,1154,TWN,Brand A,Dried Noodle With Beef Flavor Sauce,Pack,3,
1155,1155,MYS,Brand B,Mi Segera Mi Goreng Pedas Instant Noodles,Pack,3.5,
1156,1156,JPN,Brand C,Old Style Miso Ramen,Pack,3.5,
1157,1157,HKG,Brand D,Quick Serve Macaroni Abalone & Chicken Flavour,Pack,3,
1158,1158,CHN,Brand E,Rice Noodle Beef With Brown Sauce,Cup,3.5,
1159,1159,SGP,Brand F,2 Minute Noodles Assam Laksa Flavour,Pack,4,
1160,1160,MYS,Brand A,Hot Cup Perisa Kari,Cup,3.5,
1161,1161,SGP,Brand B,2 Minute Noodles Curry Flavour,Pack,3.8,
1162,1162,SGP,Brand C,Senses Laksa Instant Noodles,Pack,5,
1163,1163,SGP,Brand D,Extra Spicy Curry Instant Noodles,Pack,5,
1164,1164,KOR,Brand E,Buldak Bokkummyeon,Bowl,4,
1165,1165,COL,Brand F,Sabor A Gallina Fideos Con Instantanea,Pack,3.5,
1166,1166,JPN,Brand G,Chukazanmai Beijing Style Salt Ramen,Pack,3,
1167,1167,USA,Brand A,Miso Ramen,Bowl,3.8,
1168,1168,KOR,Brand B,Cheese Bokki,Bowl,4,
1169,1169,MYS,Brand C,Instant Penang White Curry Noodles,Pack,4.5,
1170,1170,UK,Brand D,Curry Flavour Instant Noodles,Pack,1.5,
1171,1171,VNM,Brand E,King Chef Seafood With Kimchi Flavour,Pack,3,
1172,1172,USA,Brand F,Pan Asian Kitchen Spicy Szechuan Chicken Flavor Ramen Noodles,Tray,3,
1173,1173,CHN,Brand G,Korean Clay Pot Ramyun Noodle,Cup,2.8,
1174,1174,JPN,Brand A,I Want To Eat Ramen Shio,Pack,3.8,
1175,1175,VNM,Brand B,Ngon-Ngon Tom Yum Minced Pork Noodle,Cup,3.5,
1176,1176,KOR,Brand C,Ppushu Ppushu Grilled Chicken Flavor,Pack,1,
1177,1177,TWN,Brand D,Oat Noodle Abalone Flavored,Pack,1.8,
1178,1178,JPN,Brand E,Chukazanmai Szechuan Style Miso,Pack,2,
1179,1179,HKG,Brand F,Instant Rice Vermicelli Original Flavour,Pack,0.5,
1180,1180,KOR,Brand A,Cheese Ramyun (for US market),Pack,5,
1181,1181,TWN,Brand B,Curry La-Men,Pack,5,
1182,1182,HKG,Brand C,Non-Fried Ramen Noodles TWN Roast Pork Flavour,Pack,4,
1183,1183,TWN,Brand D,Prince Katsu Snack Noodles,Pack,4,
1184,1184,MYS,Brand E,Mi Segera Tom Yam Instant Noodles,Pack,3.3,
1185,1185,CHN,Brand F,Spicy Artificial Beef Flavour Instant Noodles With Soup Base,Pack,3.5,
1186,1186,PHL,Brand G,Chicken Sopas Creamy Macaroni Soup,Cup,3.5,
1187,1187,USA,Brand A,Ramen House Thai Coconut Ramen,Pack,5,
1188,1188,IDN,Brand B,Spaghetti With Mushroom Sauce,Pack,3.8,
1189,1189,IDN,Brand C,Masala Dumdaar Noodles,Pack,3.8,
1190,1190,THA,Brand D,Instant Noodles Seafood Flavour,Cup,4,
1191,1191,UK,Brand E,Everyday Value Chicken & Mushroom Flavour,Cup,0.5,
1192,1192,IDN,Brand F,Spesial Rasa Kari Ayam Pedas,Pack,3.8,
1193,1193,JPN,Brand G,Yomise No Yakisoba Shiodare Flavor With Black Pepper Mayonnaise,Tray,3.8,
1194,1194,KOR,Brand A,Nature Is Delicious Non-Fried Ramyun (Spicy Flavor) (New Version),Pack,3.8,
1195,1195,VNM,Brand B,Oh! Ricey Pho Bo Instant Rice Noodles,Bowl,3.8,
1196,1196,SGP,Brand C,Fried Noodle Specialist Tom Yam Mee Goreng Flavour,Pack,3,
1197,1197,TWN,Brand D,Steam Seafood Flavor Ramen,Pack,4,
1198,1198,JPN,Brand E,Baby Star Snack Noodle Yakisoba Flavor,Pack,4.8,
